{
  "format": "sphere-biome-release/1",
  "descriptorFormat": "sphere-biome-pack/1",
  "manifestPath": "manifest.json",
  "manifestBytes": 3048,
  "manifestSha256": "434607cc914ab03791e4959c996da64ca178158b3f8aa7d46a9129811b62a170",
  "payloadDigest": "e8143f207b6d9b0638aade3ed7b0c9fa8b94e52a902ff52a8da55fef92570eb3"
}
